{
  "schemaVersion": "1.0.0",
  "source": {
    "name": "CIHOF curated Cleveland places starter set",
    "generatedAt": "2026-08-18",
    "note": "Manual offline place records seeded from existing inductee biographies and intended for curatorial expansion."
  },
  "placeTypes": [
    "neighborhood",
    "cultural_center",
    "church",
    "school",
    "civic_building",
    "cultural_garden",
    "business",
    "festival_location",
    "community_organization",
    "historic_address"
  ],
  "places": [
    {
      "id": "place:cleveland-cultural-gardens",
      "name": "Cleveland Cultural Gardens",
      "type": "cultural_garden",
      "shortHistory": "The gardens are one of Cleveland's clearest physical expressions of immigrant memory, cultural pride, and civic welcome. Multiple inductee biographies connect community leaders to the gardens, their federation, and individual national gardens.",
      "marker": {
        "x": 72,
        "y": 34,
        "labelOffsetX": -14,
        "labelOffsetY": -8
      },
      "neighborhood": "Rockefeller Park",
      "address": "Martin Luther King Jr. Drive corridor",
      "dateRange": {
        "label": "1916-present"
      },
      "related": {
        "people": [
          "leo-weidenthal-2010",
          "wael-khoury-2017",
          "paul-burik-2019",
          "berj-shakarian-2020",
          "anda-cook-2022",
          "joyce-mariani-2023",
          "johnny-k-wu-2024",
          "svetlana-stolyarova-2025",
          "branka-malinar-2025"
        ],
        "communities": [
          "Armenian",
          "Chinese",
          "Croatian",
          "Estonian",
          "Lebanese",
          "Polish",
          "Russian"
        ],
        "organizations": [
          "Cleveland Cultural Gardens Federation",
          "Russian Cultural Garden",
          "Croatian Cultural Garden"
        ]
      },
      "provenance": {
        "source": "Existing CIHOF inductee records",
        "confidence": "curated",
        "sourceField": "bioText",
        "note": "Seeded from biographies that reference Cleveland Cultural Gardens activity or specific national gardens."
      }
    },
    {
      "id": "place:one-world-day-rockefeller-park",
      "name": "One World Day at Rockefeller Park",
      "type": "festival_location",
      "shortHistory": "One World Day brings Cleveland communities together in the Cultural Gardens corridor. The starter record groups inductees whose biographies mention One World Day or major public cultural programming connected to the gardens.",
      "marker": {
        "x": 76,
        "y": 39,
        "labelOffsetX": -18,
        "labelOffsetY": 8
      },
      "neighborhood": "Rockefeller Park",
      "dateRange": {
        "label": "Annual festival"
      },
      "related": {
        "people": [
          "sheila-murphy-crawford-2018",
          "anda-cook-2022",
          "georgine-welo-2023",
          "dona-brady-2024",
          "johnny-k-wu-2024"
        ],
        "communities": [
          "Cleveland international communities"
        ],
        "organizations": [
          "Cleveland Cultural Gardens Federation"
        ]
      },
      "provenance": {
        "source": "Existing CIHOF inductee records",
        "confidence": "curated",
        "sourceField": "bioText",
        "note": "Initial festival-location connection; event details should be reviewed by curators."
      }
    },
    {
      "id": "place:cleveland-city-hall",
      "name": "Cleveland City Hall",
      "type": "civic_building",
      "shortHistory": "City Hall appears in CIHOF records as a civic setting for international community recognition, including the City Hall Rotunda gatherings described in Mayor Frank Jackson's biography.",
      "marker": {
        "x": 52,
        "y": 48,
        "labelOffsetX": 10,
        "labelOffsetY": -12
      },
      "neighborhood": "Downtown",
      "address": "601 Lakeside Avenue East",
      "dateRange": {
        "label": "Civic landmark"
      },
      "related": {
        "people": [
          "mayor-frank-jackson-2025",
          "tony-petkovsek-2011",
          "joe-valencic-2020",
          "joyce-mariani-2023",
          "dr-eugene-jordan-2024"
        ],
        "communities": [
          "Cleveland international communities"
        ],
        "organizations": [
          "City of Cleveland",
          "Cleveland International Hall of Fame"
        ]
      },
      "provenance": {
        "source": "Existing CIHOF inductee records",
        "confidence": "curated",
        "sourceField": "bioText",
        "note": "Seeded from biographies mentioning Cleveland City Hall or the City Hall Rotunda."
      }
    },
    {
      "id": "place:cleveland-public-library",
      "name": "Cleveland Public Library",
      "type": "cultural_center",
      "shortHistory": "The library is a downtown cultural anchor and public memory institution. It appears in several inductee records as part of Cleveland's civic and cultural infrastructure.",
      "marker": {
        "x": 54,
        "y": 51,
        "labelOffsetX": 10,
        "labelOffsetY": 10
      },
      "neighborhood": "Downtown",
      "address": "325 Superior Avenue",
      "dateRange": {
        "label": "Public institution"
      },
      "related": {
        "people": [
          "leo-weidenthal-2010",
          "joe-valencic-2020",
          "beverly-kerecman-2025",
          "andy-chakalis-2026"
        ],
        "communities": [
          "Cleveland civic community"
        ],
        "organizations": [
          "Cleveland Public Library"
        ]
      },
      "provenance": {
        "source": "Existing CIHOF inductee records",
        "confidence": "curated",
        "sourceField": "bioText",
        "note": "Starter cultural-center entry based on biographies that reference the Cleveland Public Library."
      }
    },
    {
      "id": "place:cleveland-state-university",
      "name": "Cleveland State University",
      "type": "school",
      "shortHistory": "Cleveland State University connects education, civic leadership, law, business, and public service across the CIHOF collection. Several inductees are linked to CSU through study, leadership, or institutional service.",
      "marker": {
        "x": 58,
        "y": 55,
        "labelOffsetX": 12,
        "labelOffsetY": 8
      },
      "neighborhood": "Campus District",
      "address": "Euclid Avenue",
      "dateRange": {
        "label": "University"
      },
      "related": {
        "people": [
          "mayor-frank-jackson-2025",
          "alex-machaskee-2010",
          "jeanette-grasselli-brown-2010",
          "margaret-w-wong-2010",
          "jose-c-feliciano-2012",
          "monte-ahuja-2014"
        ],
        "communities": [
          "Cleveland education community"
        ],
        "organizations": [
          "Cleveland State University"
        ]
      },
      "provenance": {
        "source": "Existing CIHOF inductee records",
        "confidence": "curated",
        "sourceField": "bioText",
        "note": "Seeded from biographies that mention Cleveland State University."
      }
    },
    {
      "id": "place:max-s-hayes-high-school",
      "name": "Max S. Hayes High School",
      "type": "school",
      "shortHistory": "Mayor Frank Jackson's biography identifies Max S. Hayes High School as part of his Cleveland education story before military service, college, law, and public office.",
      "marker": {
        "x": 35,
        "y": 45,
        "labelOffsetX": -16,
        "labelOffsetY": -10
      },
      "neighborhood": "West Side",
      "dateRange": {
        "label": "School"
      },
      "related": {
        "people": [
          "mayor-frank-jackson-2025"
        ],
        "communities": [
          "Cleveland education community"
        ],
        "organizations": [
          "Max S. Hayes High School"
        ]
      },
      "provenance": {
        "source": "Existing CIHOF inductee records",
        "confidence": "curated",
        "sourceField": "bioText",
        "note": "Starter school entry based on Mayor Frank Jackson's biography."
      }
    },
    {
      "id": "place:st-colman-church",
      "name": "St. Colman Church",
      "type": "church",
      "shortHistory": "St. Colman appears in Fr. Jim O'Donnell's CIHOF record and represents the role of churches as neighborhood anchors in Cleveland's immigrant and civic life.",
      "marker": {
        "x": 38,
        "y": 53,
        "labelOffsetX": -16,
        "labelOffsetY": 8
      },
      "neighborhood": "Near West Side",
      "related": {
        "people": [
          "fr-jim-o-donnell-2012"
        ],
        "communities": [
          "Irish American",
          "Near West Side"
        ],
        "organizations": [
          "St. Colman Church"
        ]
      },
      "provenance": {
        "source": "Existing CIHOF inductee records",
        "confidence": "curated",
        "sourceField": "bioText",
        "note": "Starter church entry based on Fr. Jim O'Donnell's biography."
      }
    },
    {
      "id": "place:asiatown",
      "name": "AsiaTown",
      "type": "neighborhood",
      "shortHistory": "AsiaTown is a Cleveland neighborhood context for Asian cultural life, business, organizing, and public festivals. The starter record groups nearby business and community references from the collection.",
      "marker": {
        "x": 61,
        "y": 43,
        "labelOffsetX": 12,
        "labelOffsetY": -8
      },
      "neighborhood": "AsiaTown",
      "dateRange": {
        "label": "Neighborhood"
      },
      "related": {
        "people": [
          "donna-hom-2014",
          "johnny-k-wu-2024",
          "margaret-w-wong-2010",
          "giahoa-ryan-2011"
        ],
        "communities": [
          "Asian American",
          "Chinese American",
          "Vietnamese American"
        ],
        "organizations": [
          "AsiaTown Cleveland"
        ]
      },